1.402	Spagaatsprong voorwaarts met 1 /1 draai (360º) – afzet van één been	1	D
1.103	Hurksprong met spreiden van de benen  tot dwars - spagaat (180º) tijdens de vluchtfase	1	A
1.204	Spagaatsprong voorwaarts met beenwissel en ¼ draai (90º) tot zijwaartse spagaat  of tot spreidhoekpositie (beide benen boven horizontaal (Johnson)	1	B
1.105	Loopsprong voorwaarts met beenwissel tot hurk-hoekpositie	1	A
1.205	Spagaatsprong voorwaarts met beenwissel (180º  beenspreiding na de beenwissel)	1	B
1.305	Spagaatsprong voorwaarts met beenwissel tot ringhouding (180º beenspreiding)	1	C
1.405	Spagaatsprong voorwaarts met beenwissel tot ringhouding  en ½ draai (180°)	1	D
1.106	Hoeksprong ( heuphoek < 90° ) met ½ draai (180º)	1	A
1.206	Schaapsprong (bovenlichaam achterwaarts gebogen en hoofd achterover en de voeten bijna het hoofd rakend)	1	B
1.306	Hoeksprong ( heuphoek < 90° ) met 1/1 draai ( 360º)	1	C
1.309	Loopspagaatringsprong (180º ) beenspreiding  – afzet van één been	1	C
1.110	Streksprong met 1/1 draai (360º)	1	A
1.310	Streksprong met 2/1 draai (720º)	1	C
1.111	Kattensprong met afwisselende beenwissel (knieën boven horizontaal )	1	A
1.211	Kattensprong met afwisselende beenwissel (knieën boven horizontaal) met 1/1 draai (360º )	1	B
1.311	Kattensprong met  2/1 draai (720º)	1	C
1.112	Fouettésprong tot landing in arabesque (vrije been boven horizontaal)	1	A
1.212	Sprong met ½ draai (180°), vrije been gedurende de draai gestrekt boven horizontaal	1	B
1.312	Sprong met 1/1 draai (360º), vrije been gedurende de gehele draai gestrekt boven horizontaal	1	C
1.213	Hurksprong met 1/1  draai (360º)	1	B
1.114	Hurkhoeksprong (één been gebogen en het andere been voorwaarts gestrekt , boven  horizontaal met gesloten knieën )	1	A
1.514	Hurkhoeksprong met 2/1 draai (720º)	1	E
2.101	1/1 draai (360º) op één been - vrije been onder de horizontaal naar keuze	2	A
2.201	2/1 draai (720º) op één  been - vrije been onder de horizontaal naar keuze ’	2	B
2.301	3/1 draai (1080º) op één been - vrije been onder de horizontaal naar keuze	2	C
2.501	4/1 draai (1440º) op één been – vrije been onder de horizontaal naar keuze	2	E
2.202	1/1 draai (360º) met het vrije been van het begin tot het ein de van de draai op horizontaal, ook met vasthouden van het vrije been (standbeen en vrije been mogen gestrekt of gebogen zijn)	2	B
2.402	2/1 draai (720º) met het vrije been van het begin tot het einde van de draai op  horizontaal , ook met vasthouden van het vrije been (standbeen en vrije been mogen gestrekt of gebogen zijn)	2	D
2.203	1/1 draai (360º) met het vrije been vastgehouden  in 180º spagaat positie  gedurende de gehele draai	2	B
2.403	2/1 draai ( 720°) met het vrije been vastgehouden  in 180º spagaat positie  gedurende de gehele draai	2	D
2.503	3/1 draai (1080 º) met het vrije been vastgehouden  in 180º spagaat positie  gedurende de gehele draai	2	E
2.204	1/1 draai (360 ) op 1 been in “back attitude” (de knie van het vrije been op horizontaal gedurende de gehele draai )	2	B
2.205	1/1 draai (360) in zweefstand met vrije been boven horizo ntaal gedurende de gehele draai	2	B
2.206	1/1 duikdraai (360º) door standspagaat zonder aanraken van de vloer met de handen	2	B
2.207	1/1 draai (360º)  pirouette  in hurkzit op één been - vrije been recht gedurende de draai	2	B
2.307	2/1 draai (720º) pirouette gestart met vrije been op horizontaal, naar beneden tot eindiging van draai in hurk hoek positie	2	C
2.407	2/1 draai (720º) pirouette in hurkzit op één been - vrije been recht gedurende de draai (geen afzet van de handen toegestaan bij de start van de draai)	2	D
2.507	3/1 draai (1080º) pirouette in hurkzit op één been - vrije been recht gedurende de draai (geen afzet van de handen toegestaan bij de start van de dr aai)	2	E
2.208	2/1 draai (720º) of meer op de rug in kiphouding (been - romphoek gesloten)	2	B
3.101	Springen, zwaaien of heffen tot handstand – beweging erna naar keuze, ook met ½  en 1/1 draai (180º -360º) in handstand	3	A
3.201	Springen, zwaaien of heffen tot handstand met 1½ -2/1 draai ( 540º-720º) in handstand  – beweging erna naar k euze	3	B
3.102	Hechtrol	3	A
3.103	Rol achterover tot handstand met ½ of 1/1 draai (180º -360º) in handstand	3	A
3.203	Rol achterover tot handstand met 1½ - 2/1 draai ( 540°-720º) in handstand	3	B
3.104	Langzame overslag achterover vanuit stand of hurkspreidzit tot handstand met 1/1 draai (360º) in handstand - beweging erna naar keuze	3	A
3.105	Overslag v.o. - afzet van één been of o verslag v.o. - afzet van beide benen - met of zonder hechtfase voor de steun van de handen - landing naar keuze   Sprong achterwaarts met ½ draai (180º) tot overslag v.o. (twistoverslag) - landing naar keuze	3	A
3.305	Overslag v.o. met 1/1 draai (360º) na de steun van de handen of voor de steun	3	C
3.106	Arabier	3	A
3.107	Alle flik-flak- en Auerbach -flik-flak- variaties, ook met steun van één arm	3	A
3.207	Flik-flak met 1/1 draai (360º)  voor de steun van de handen	3	B
4.101	Salto v.o.  gehurkt  of gehoekt	4	A
4.201	Salto v.o. gehurkt met ½ of 1/1 draai (180º -360º), ook salto v.o. gehoekt met ½ draai (180º)	4	B
4.501	Dubbele salto v.o. gehurkt	4	E
4.601	Dubbel salto v.o. gehurkt met ½ draai (180°)   Dubbel salto v.o. gehoekt	4	F
4.202	Salto v.o. gestrekt ; ook met ½ draai (180º)	4	B
4.302	Salto v.o. gestrekt met 1/1 of 1½ draai (360º of 540º)	4	C
4.402	Salto v.o. gestrekt met 2/1 draai (720º)	4	D
4.502	Salto v.o. gestrekt met  2½ draai (900º)	4	E
4.602	Salto v.o. gestrekt met 3/1 draai (1080 º)	4	F
4.103	Vrije (aerial) overslag v.o.	4	A
4.104	Vrije (aerial) radslag of vrije (aerial) arabier	4	A
4.105	Vanuit afzet vw met één of beide benen – salto zijwaarts gehurkt of gehoekt	4	A
4.205	Twistsalto gehurkt of gehoekt ( afzet achterover met ½ draai (180º), salto v.o.) – landing naar keuze	4	B
4.505	Dubbele twistsalto gehurkt, ook met ½ draai (180 )	4	E
4.605	Dubbele twistsalto gehoekt   Ook met ½ draai (180)	4	F
4.805	Dubbele twistsalto gestrekt	4	H
5.101	Salto a.o. gehurkt, gehoekt, gestrekt	5	A
5.201	Salto a.o. gehurkt of gestrekt met ½ of 1/1 draai (180º of 360º)	5	B
5.301	Salto a.o. gestrekt met 1½  of 2/1 draai (540º of 720º)	5	C
5.401	Salto a.o. gestrekt met 2½ draai (900º)	5	D
5.501	Salto a.o. gestrekt met 3/1 draai (1080º)	5	E
5.601	Salto a.o. gestrekt met 3 ½ draai (1260º)	5	F
5.402	Dubbele salto a.o. gehurkt of gehoekt	5	D
5.502	Dubbele salto a.o. gehurkt of gehoekt met 1/1 draai (360º)	5	E
5.802	Dubbele salto a.o. gehurkt met 2/1 draai (720º)	5	H
5.1002	Dubbele salto a.o. gehurkt met  3/1 draai ( 1080º)	5	J
5.603	Dubbele salto a.o. gestrekt	5	F
5.703	Dubbel salto a.o. gestrekt met ½ draai (180°)	5	G
5.803	Dubbele salto a.o. gestrekt met 1/1 draai (360º)	5	H
5.903	Dubbel salto a.o. gestrekt met 2/1 draai (720°)	5	I
5.104	Temposalto	5	A
5.204	Temposalto met ½ draai (180º)	5	B
5.304	Temposalto met 1/1 draai (360º)	5	C
1.001	Loopsprong voorwaarts (beenspreiding 135º)	1	TA
1.002	Loopsprong op de plaats (beenspreiding 135º)	1	TA
1.005	Wisselloopsprong (beenspreiding 135º)	1	TA
1.007	Spreidsprong met gestrekte heupen (beenspreiding 135º)	1	TA
1.009	Sisonne (beenspreiding 135º)	1	TA
1.010	Streksprong met 1/2 draai (180º)	1	TA
1.011	Schaarsprong voorwaarts met gestrekte benen	1	TA
1.012	Hurksprong (benen gesloten), ook met ½ draai - afzet van een of beide benen	1	TA
2.001	½ draai  (180°) op 1 been - vrije been  in passé  Geldt alleen voor supplement 3 t/m 7	2	TA
3.001	Zwaaien tot handstand , vluchtig of 1 seconde (180°)   Handstanddoorrol	3	TA
3.002	Rol voorover of snelle rol voorover zonder handensteun	3	TA
3.003	Rol achterover  (tot handstand)	3	TA
3.004	Langzame overslag voorover of l angzame overslag v.o., a.o. (Tik-Tak)	3	TA
3.005	Langzame overslag achterover, ook vanuit hurkspreidzit (Valdez)	3	TA
3.006	Radslag	3	TA
3.007	Radslag  op 1 arm	3	TA
6.001	Geldt alleen voor supplement 6 t/m 7  Spreidzit met buik op de grond	6	TA
